{
  "captainDecision": {
    "allowedActions": [
      "APPROVE_FOR_PROVIDER_RESEARCH",
      "REQUEST_MORE_EVIDENCE",
      "REJECT"
    ],
    "required": true
  },
  "discoverySummary": {
    "automatedDiscoveryCount": 13,
    "candidateCount": 13,
    "humanProvidedLeadCount": 0,
    "methods": {
      "calendar_feed_pattern": 1,
      "existing_source_intelligence": 1,
      "government_domain_pattern": 1,
      "institutional_calendar_pattern": 2,
      "known_platform_pattern": 2,
      "official_domain_search": 5,
      "regional_institution_pattern": 1
    },
    "scope": "Structured source discovery and supplied leads; not a general internet crawl."
  },
  "generatedAt": "2026-08-07T08:01:24.355503Z",
  "kind": "civic-expansion-queue",
  "queue": [
    {
      "category": "meetings",
      "classification": "READY",
      "coverageValue": "high",
      "discovery": {
        "confidence": 0.98,
        "foundAt": "2026-08-07T00:00:00Z",
        "method": "known_platform_pattern",
        "methodDetail": "Probed the common Legistar civic-meeting host pattern and confirmed Denver's official publisher.",
        "origin": "automated"
      },
      "estimatedProviderDifficulty": "MEDIUM",
      "evaluationReasoning": "High-authority publisher, identifiable structure, and an existing Gremlin Lab provider pattern are present.",
      "id": "denver-legistar-meetings",
      "likelyDataType": "HTML calendar",
      "publisher": "City and County of Denver",
      "rank": 1,
      "recommendedAction": "Captain may approve immediate provider research and fixture capture.",
      "scores": {
        "coverageGapMultiplier": 1.5,
        "coverageImpact": 5,
        "difficulty": 3,
        "impactEffortRatio": 12.5,
        "trust": 5
      },
      "trustSignals": {
        "authority": "government",
        "governance": [
          "Official city legislative calendar",
          "Meeting agendas and public-comment sessions"
        ],
        "maintenance": [
          "Current dated meetings observed"
        ],
        "stability": [
          "Legistar calendar platform",
          "Stable meeting-detail links",
          "Calendar export controls"
        ]
      },
      "url": "https://denver.legistar.com/Calendar.aspx"
    },
    {
      "category": "volunteer",
      "classification": "READY",
      "coverageValue": "high",
      "discovery": {
        "confidence": 0.94,
        "foundAt": "2026-08-07T00:00:00Z",
        "method": "official_domain_search",
        "methodDetail": "Followed the official parks volunteer portal to its public calendar view.",
        "origin": "automated"
      },
      "estimatedProviderDifficulty": "MEDIUM",
      "evaluationReasoning": "High-authority publisher, identifiable structure, and an existing Gremlin Lab provider pattern are present.",
      "id": "engage-denver-volunteer-calendar",
      "likelyDataType": "HTML calendar",
      "publisher": "Denver Parks & Recreation",
      "rank": 2,
      "recommendedAction": "Captain may approve immediate provider research and fixture capture.",
      "scores": {
        "coverageGapMultiplier": 1.5,
        "coverageImpact": 5,
        "difficulty": 3,
        "impactEffortRatio": 12.5,
        "trust": 5
      },
      "trustSignals": {
        "authority": "government",
        "governance": [
          "Official denvergov.org volunteer system",
          "Parks department opportunities"
        ],
        "maintenance": [
          "Current activities and open-assignment filtering observed"
        ],
        "stability": [
          "Dedicated calendar endpoint",
          "Public opportunity descriptions"
        ]
      },
      "url": "https://engagedenver.denvergov.org/CalendarList?onlyShowActivitiesWithOpenAssignments=true&showActivities=true"
    },
    {
      "category": "culturalActivities",
      "classification": "READY",
      "coverageValue": "high",
      "discovery": {
        "confidence": 0.96,
        "foundAt": "2026-08-07T00:00:00Z",
        "method": "official_domain_search",
        "methodDetail": "Searched official Denver agency domains for structured event calendars.",
        "origin": "automated"
      },
      "estimatedProviderDifficulty": "MEDIUM",
      "evaluationReasoning": "High-authority publisher, identifiable structure, and an existing Gremlin Lab provider pattern are present.",
      "id": "denver-arts-venues-calendar",
      "likelyDataType": "HTML calendar",
      "publisher": "Denver Arts & Venues",
      "rank": 3,
      "recommendedAction": "Captain may approve immediate provider research and fixture capture.",
      "scores": {
        "coverageGapMultiplier": 0.65,
        "coverageImpact": 5,
        "difficulty": 3,
        "impactEffortRatio": 5.42,
        "trust": 5
      },
      "trustSignals": {
        "authority": "government",
        "governance": [
          "Denver city agency",
          "Agency-managed public venues"
        ],
        "maintenance": [
          "Current event dates and venue filters observed"
        ],
        "stability": [
          "Paginated calendar",
          "Individual event pages",
          "Venue taxonomy"
        ]
      },
      "url": "https://www.artsandvenuesdenver.com/events/calendar"
    },
    {
      "category": "publicSpaces",
      "classification": "READY",
      "coverageValue": "medium",
      "discovery": {
        "confidence": 0.93,
        "foundAt": "2026-08-07T00:00:00Z",
        "method": "known_platform_pattern",
        "methodDetail": "Checked the ArcGIS Hub/group pattern used by municipal open-data catalogs.",
        "origin": "automated"
      },
      "estimatedProviderDifficulty": "LOW",
      "evaluationReasoning": "High-authority publisher, identifiable structure, and an existing Gremlin Lab provider pattern are present.",
      "id": "denver-open-data-arcgis",
      "likelyDataType": "ArcGIS",
      "publisher": "City and County of Denver Open Data Catalog",
      "rank": 4,
      "recommendedAction": "Captain may approve immediate provider research and fixture capture.",
      "scores": {
        "coverageGapMultiplier": 0.65,
        "coverageImpact": 3,
        "difficulty": 2,
        "impactEffortRatio": 4.88,
        "trust": 5
      },
      "trustSignals": {
        "authority": "government",
        "governance": [
          "Official Denver open-data group",
          "Published CC BY 3.0 licensing"
        ],
        "maintenance": [
          "Public ArcGIS catalog remains accessible"
        ],
        "stability": [
          "ArcGIS item identifiers",
          "Existing Gremlin Lab ArcGIS adapter pattern"
        ]
      },
      "url": "https://www.arcgis.com/home/group.html?id=31a0c1babcc84c80b4ebcff5fecb159b"
    },
    {
      "category": "culturalActivities",
      "classification": "READY",
      "coverageValue": "high",
      "discovery": {
        "confidence": 0.94,
        "foundAt": "2026-08-07T00:00:00Z",
        "method": "institutional_calendar_pattern",
        "methodDetail": "Searched major public-facing cultural institutions for paginated calendars.",
        "origin": "automated"
      },
      "estimatedProviderDifficulty": "MEDIUM",
      "evaluationReasoning": "High-authority publisher, identifiable structure, and an existing Gremlin Lab provider pattern are present.",
      "id": "denver-botanic-gardens-calendar",
      "likelyDataType": "HTML calendar",
      "publisher": "Denver Botanic Gardens",
      "rank": 5,
      "recommendedAction": "Captain may approve immediate provider research and fixture capture.",
      "scores": {
        "coverageGapMultiplier": 0.65,
        "coverageImpact": 5,
        "difficulty": 3,
        "impactEffortRatio": 4.33,
        "trust": 4
      },
      "trustSignals": {
        "authority": "public_institution",
        "governance": [
          "Long-running regional cultural and botanical institution"
        ],
        "maintenance": [
          "Hundreds of current results and explicit page count observed"
        ],
        "stability": [
          "Numbered pagination",
          "Individual event detail pages",
          "Category and location filters"
        ]
      },
      "url": "https://www.botanicgardens.org/calendar?location%5B231%5D=231&page=0"
    },
    {
      "category": "libraries",
      "classification": "READY",
      "coverageValue": "high",
      "discovery": {
        "confidence": 0.9,
        "foundAt": "2026-08-07T00:00:00Z",
        "method": "official_domain_search",
        "methodDetail": "Identified the library's official event endpoint from its documented calendar launch.",
        "origin": "automated"
      },
      "estimatedProviderDifficulty": "MEDIUM",
      "evaluationReasoning": "High-authority publisher, identifiable structure, and an existing Gremlin Lab provider pattern are present.",
      "id": "denver-library-events",
      "likelyDataType": "HTML calendar",
      "publisher": "Denver Public Library",
      "rank": 6,
      "recommendedAction": "Captain may approve immediate provider research and fixture capture.",
      "scores": {
        "coverageGapMultiplier": 0.65,
        "coverageImpact": 5,
        "difficulty": 3,
        "impactEffortRatio": 4.33,
        "trust": 4
      },
      "trustSignals": {
        "authority": "public_institution",
        "governance": [
          "Official public library system"
        ],
        "maintenance": [
          "Library describes a current event calendar with date, location, and event-type filters"
        ],
        "stability": [
          "Individual event pages",
          "Location filters",
          "Calendar-add function"
        ]
      },
      "url": "https://www.denverlibrary.org/events"
    },
    {
      "category": "events",
      "classification": "INVESTIGATE",
      "coverageValue": "high",
      "discovery": {
        "confidence": 0.78,
        "foundAt": "2026-08-07T00:00:00Z",